{
  "schema": 1,
  "product": "table-flow",
  "sourceRevision": "working-tree",
  "generatedAt": "2026-10-03T14:56:23.642Z",
  "facts": {
    "version.current": {
      "value": "1.6.1",
      "effectiveFromVersion": "1.6.1",
      "source": "release-repo"
    },
    "features.autoPaging": {
      "status": "available",
      "effectiveFromVersion": "1.0.0"
    },
    "features.localProcessing": {
      "status": "available",
      "effectiveFromVersion": "1.0.0"
    },
    "pricing.pro.monthly": {
      "value": 5,
      "currency": "CNY",
      "period": "month",
      "since": "1.5.0",
      "effectiveFromVersion": "1.5.0"
    },
    "pricing.pro.yearly": {
      "value": 40,
      "currency": "CNY",
      "period": "year",
      "since": "1.5.0",
      "effectiveFromVersion": "1.5.0"
    }
  },
  "copy": {
    "overview.title": {
      "default": "网页表格采集与导出"
    },
    "overview.summary": {
      "default": "从网页已显示的表格中提取数据并导出。",
      "variants": {
        "table-flow-panel": "从网页表格中提取并导出数据。"
      }
    },
    "features.autoPaging": {
      "default": "支持自动翻页采集与断线续采。"
    },
    "features.localProcessing": {
      "default": "采集、预览与导出默认在浏览器本地完成。"
    },
    "install.summary": {
      "default": "Edge 用户可从商店安装，其他 Chromium 浏览器使用压缩包加载。"
    },
    "update.badge": {
      "default": "在线激活修复"
    },
    "update.summary": {
      "default": "修复部分激活码提示错误"
    },
    "update.text": {
      "default": "修复在线激活码被误报为未登记的问题。"
    },
    "update.detail": {
      "default": "本版本修复了特定情况下在线激活码验证提示错误的问题。"
    }
  },
  "update": {
    "badge": "在线激活修复",
    "summary": "修复部分激活码提示错误",
    "text": "修复在线激活码被误报为未登记的问题。",
    "detail": "本版本修复了特定情况下在线激活码验证提示错误的问题。"
  },
  "contentRevision": "content-ea90484723ae",
  "sha256": "ea90484723ae2ca87f8a7a58c5802090a9f30b62b55b3771298db8b2c5ab4418"
}
