{
  "schema": 1,
  "product": "wps-enhancer",
  "sourceRevision": "working-tree",
  "generatedAt": "2026-10-03T14:56:23.656Z",
  "facts": {
    "version.current": {
      "value": "1.1.0",
      "effectiveFromVersion": "1.1.0",
      "source": "release-repo"
    },
    "features.builtInUpdater": {
      "status": "available",
      "effectiveFromVersion": "1.1.0"
    }
  },
  "copy": {
    "overview.title": {
      "default": "WPS Enhancer"
    },
    "overview.summary": {
      "default": "为 WPS 工作流提供桌面端增强能力。"
    },
    "install.summary": {
      "default": "首次安装使用对应平台安装包，后续由应用内更新器检查更新。"
    },
    "update.badge": {
      "default": "应用内更新"
    },
    "update.summary": {
      "default": "应用启动后自动检查可用更新。"
    },
    "update.text": {
      "default": "更新说明会在应用内显示。"
    },
    "update.detail": {
      "default": "WPS Enhancer 使用应用内更新器处理后续版本更新。"
    }
  },
  "update": {
    "badge": "应用内更新",
    "summary": "应用启动后自动检查可用更新。",
    "text": "更新说明会在应用内显示。",
    "detail": "WPS Enhancer 使用应用内更新器处理后续版本更新。"
  },
  "contentRevision": "content-231a334cf208",
  "sha256": "231a334cf2083c916ee616174c4bfbfd6494a1c5622d93e060cfbab7c9fb5d19"
}
